[
  {
    "id": "obelix-solid-electrolytes",
    "name": "OBELiX (Open solid Battery Electrolytes with Li)",
    "description": "Curated dataset of 599 synthesized lithium solid-state electrolyte materials with experimentally measured room-temperature ionic conductivities, space groups, lattice parameters and compositions, including full CIF crystal structures for 321 entries. Hand-curated from the experimental literature by NRC/Mila with a leakage-avoiding train/test split and ML baselines; pip-installable as obelix-data.",
    "domain": "materials",
    "subdomain": "batteries",
    "tags": ["solid-state-electrolytes", "ionic-conductivity", "lithium", "crystal-structures", "benchmark", "machine-learning"],
    "data_type": "experimental",
    "access": "open",
    "license": "CC-BY-4.0",
    "doi": "10.1039/D5DD00441A",
    "homepage_url": "https://github.com/NRC-Mila/OBELiX",
    "repository": "GitHub",
    "associated_paper": "Therrien et al., 'OBELiX: a curated dataset of crystal structures and experimentally measured ionic conductivities for lithium solid-state electrolytes', Digital Discovery (2026)",
    "year": 2025,
    "source": "api-discovery",
    "verified_via": "https://github.com/NRC-Mila/OBELiX"
  },
  {
    "id": "kit-electrolyte-conductivity-5035",
    "name": "5035 Conductivity Experiments for Li-Ion Battery Electrolytes",
    "description": "Dataset of 5,035 electrochemical impedance spectroscopy conductivity experiments on liquid lithium-ion battery electrolyte formulations (EC/PC/EMC solvents with LiPF6 at varied salt concentrations) across temperatures, with derived activation energies. Generated on a high-throughput formulation-and-measurement platform at KIT/Forschungszentrum Juelich within the BIG-MAP project; single CSV (~39 MB) on Zenodo.",
    "domain": "chemistry",
    "subdomain": "batteries",
    "tags": ["electrolytes", "ionic-conductivity", "lithium-ion", "high-throughput", "impedance-spectroscopy", "big-map"],
    "data_type": "experimental",
    "access": "open",
    "license": "CC-BY-4.0",
    "doi": "10.5281/zenodo.7244939",
    "homepage_url": "https://zenodo.org/records/7244939",
    "repository": "Zenodo",
    "associated_paper": "Rahmanian et al., 'Conductivity experiments for electrolyte formulations and their automated analysis', Sci. Data 10:43 (2023)",
    "year": 2022,
    "source": "api-discovery",
    "verified_via": "https://zenodo.org/records/7244939"
  },
  {
    "id": "core-mof-2024",
    "name": "CoRE MOF 2024 Database",
    "description": "2024 release of the Computation-Ready Experimental MOF database: 8,300 experimentally reported MOF crystal structures (2,664 computation-ready) with precomputed geometric, charge, stability and hydrophobicity properties, plus pointers to 32,537 additional CSD-derived structures; full DB spans 40,837 structures. Major expansion of the CoRE MOF 2019 release already in this catalog, with a web interface at mof-db.pusan.ac.kr.",
    "domain": "materials",
    "subdomain": "mofs-porous",
    "tags": ["mofs", "crystal-structures", "adsorption", "porous-materials", "computation-ready", "screening"],
    "data_type": "mixed",
    "access": "open",
    "license": "CC-BY-4.0",
    "doi": "10.5281/zenodo.15055758",
    "homepage_url": "https://zenodo.org/records/15055758",
    "repository": "Zenodo",
    "associated_paper": "Zhao et al., 'CoRE MOF DB: a curated experimental metal-organic framework database with machine-learned properties for integrated material-process screening', Matter 8 (2025)",
    "year": 2025,
    "source": "api-discovery",
    "verified_via": "https://zenodo.org/records/15055758"
  },
  {
    "id": "openpoly-benchmark",
    "name": "OpenPoly Polymer Benchmark",
    "description": "Literature-derived benchmark dataset of 3,985 polymer entries (PSMILES-encoded backbones) annotated with up to 26 experimentally measured properties, curated by the Wang group (Fudan) for multi-property polymer ML under data-limited conditions. Ships with baselines for 8 model families; pretrained weights on Zenodo (10.5281/zenodo.15551637).",
    "domain": "chemistry",
    "subdomain": "polymers",
    "tags": ["polymers", "property-prediction", "benchmark", "machine-learning", "psmiles", "literature-mining"],
    "data_type": "experimental",
    "access": "open",
    "license": "MIT",
    "doi": "10.1007/s10118-025-3402-y",
    "homepage_url": "https://github.com/WangGroupFDU/Openpoly_benchmark",
    "repository": "GitHub / Zenodo",
    "associated_paper": "Wang et al., 'OpenPoly: A Polymer Database Empowering Benchmarking and Multi-property Predictions', Chin. J. Polym. Sci. (2025)",
    "year": 2025,
    "source": "api-discovery",
    "verified_via": "https://github.com/WangGroupFDU/Openpoly_benchmark"
  }
]
