[
  {"id": "multistage-liion-aging-dataset", "name": "Multi-Stage Lithium-Ion Battery Aging Dataset", "description": "Experimental Li-ion aging dataset built with multiple design-of-experiment methodologies: 280 files (10.3 GB) of cycling/aging measurements across stages and conditions. Deposited with the Scientific Data descriptor (2024).", "domain": "materials", "subdomain": "batteries", "tags": ["lithium-ion", "aging", "cycling-data", "design-of-experiments"], "data_type": "experimental", "access": "open", "license": "CC-BY-4.0", "doi": "10.6084/m9.figshare.25975315.v1", "homepage_url": "https://figshare.com/articles/dataset/Multi-Stage_Lithium_Ion_Battery_Aging_Study/25975315/1", "repository": "Figshare", "associated_paper": "'A multi-stage lithium-ion battery aging dataset using various experimental design methodologies', Sci. Data (2024), doi:10.1038/s41597-024-03859-z", "year": 2024, "source": "api-discovery", "verified_via": "https://api.datacite.org/dois?query=relatedIdentifiers.relatedIdentifier:%2210.1038/s41597-024-03859-z%22"},
  {"id": "pem-fuel-cell-catalyst-degradation", "name": "In-Situ PEM Fuel Cell Cathode Catalyst Degradation Dataset", "description": "Experimental in-situ characterization of cathode catalyst degradation in proton-exchange-membrane fuel cells: 51 files (851 MB) of electrochemical and characterization data with analysis scripts. Scientific Data descriptor (2024).", "domain": "materials", "subdomain": "electrocatalysis-exp", "tags": ["pem-fuel-cell", "catalyst-degradation", "in-situ", "electrochemistry"], "data_type": "experimental", "access": "open", "license": "CC-BY-4.0", "doi": "10.6084/m9.figshare.25450177.v1", "homepage_url": "https://figshare.com/articles/dataset/_b_In-Situ_Characterization_of_Cathode_Catalyst_Degradation_in_PEM_Fuel_Cells_b_/25450177/1", "repository": "Figshare", "associated_paper": "'In-Situ Characterization of Cathode Catalyst Degradation in PEM Fuel Cells', Sci. Data (2024), doi:10.1038/s41597-024-03662-w", "year": 2024, "source": "api-discovery", "verified_via": "https://api.datacite.org/dois?query=relatedIdentifiers.relatedIdentifier:%2210.1038/s41597-024-03662-w%22"},
  {"id": "wse2-multidim-photoemission", "name": "Multidimensional Photoemission Spectra of WSe2", "description": "Measured multidimensional (time/angle-resolved) photoemission spectroscopy data of tungsten diselenide: 6.2 GB HDF5 volumes released with an open-source end-to-end workflow for multidimensional photoemission spectroscopy. Scientific Data (2020).", "domain": "materials", "subdomain": "spectra-exp", "tags": ["arpes", "photoemission", "2d-materials", "hdf5", "trarpes"], "data_type": "experimental", "access": "open", "license": "CC-BY-4.0", "doi": "10.5281/zenodo.2704787", "homepage_url": "https://zenodo.org/record/2704787", "repository": "Zenodo", "associated_paper": "'An open-source, end-to-end workflow for multidimensional photoemission spectroscopy', Sci. Data (2020), doi:10.1038/s41597-020-00769-8", "year": 2020, "source": "api-discovery", "verified_via": "https://api.datacite.org/dois?query=relatedIdentifiers.relatedIdentifier:%2210.1038/s41597-020-00769-8%22"},
  {"id": "libs-benchmark-classification", "name": "LIBS Benchmark Classification Dataset", "description": "Benchmark dataset of measured laser-induced breakdown spectroscopy (LIBS) spectra for classification: 7.6 GB HDF5 training set (plus test set) covering many sample classes, released as a Scientific Data descriptor (2020). CC0.", "domain": "materials", "subdomain": "spectra-exp", "tags": ["libs", "spectroscopy", "benchmark", "classification", "hdf5"], "data_type": "experimental", "access": "open", "license": "CC0-1.0", "doi": "10.6084/m9.figshare.11316578.v1", "homepage_url": "https://springernature.figshare.com/articles/Training_dataset/11316578/1", "repository": "Figshare", "associated_paper": "'Benchmark classification dataset for laser-induced breakdown spectroscopy', Sci. Data (2020), doi:10.1038/s41597-020-0396-8", "year": 2020, "source": "api-discovery", "verified_via": "https://springernature.figshare.com/articles/Training_dataset/11316578/1"},
  {"id": "chemdataextractor-battery-db", "name": "Battery Materials Database (ChemDataExtractor, Huang & Cole)", "description": "Literature-mined database of experimentally reported battery material properties auto-generated with ChemDataExtractor: ~292,000 records (capacity, voltage, conductivity, Coulombic efficiency, energy density) extracted from ~229,000 papers. Scientific Data (2020).", "domain": "materials", "subdomain": "batteries", "tags": ["battery-materials", "text-mining", "literature-curated", "capacity", "conductivity"], "data_type": "experimental", "access": "open", "license": "CC0-1.0", "doi": "10.6084/m9.figshare.12646277.v1", "homepage_url": "https://springernature.figshare.com/articles/Metadata_record_for_A_database_of_battery_materials_auto-generated_using_ChemDataExtractor/12646277/1", "repository": "Figshare", "associated_paper": "Huang & Cole, 'A database of battery materials auto-generated using ChemDataExtractor', Sci. Data (2020), doi:10.1038/s41597-020-00602-2", "year": 2020, "source": "api-discovery", "verified_via": "https://api.datacite.org/dois?query=relatedIdentifiers.relatedIdentifier:%2210.1038/s41597-020-00602-2%22"}
]
